{
  "$schema": "https://json-schema.org/draft/2020-12/schema",
  "additionalProperties": true,
  "properties": {
    "base_branch": {
      "type": "string"
    },
    "base_drift": {
      "type": "string"
    },
    "base_sha": {
      "type": "string"
    },
    "changed_paths": {
      "type": "string"
    },
    "ci_result": {
      "type": "string"
    },
    "custody_requirement": {
      "type": "string"
    },
    "deadline": {
      "type": "string"
    },
    "dependency_state": {
      "type": "string"
    },
    "draft_state": {
      "type": "string"
    },
    "exact_next_action": {
      "type": "string"
    },
    "founder_decision_required": {
      "type": "string"
    },
    "governance_classification": {
      "type": "string"
    },
    "head_branch": {
      "type": "string"
    },
    "head_sha": {
      "type": "string"
    },
    "implementation_effect": {
      "type": "string"
    },
    "lifecycle_effect": {
      "type": "string"
    },
    "merge_authority_state": {
      "type": "string"
    },
    "merge_state": {
      "type": "string"
    },
    "mergeability": {
      "type": "string"
    },
    "overlap_with_other_prs": {
      "type": "string"
    },
    "pr_number": {
      "type": "string"
    },
    "recommended_disposition": {
      "type": "string"
    },
    "repository": {
      "type": "string"
    },
    "responsible_owner": {
      "type": "string"
    },
    "review_thread_state": {
      "type": "string"
    },
    "schema_effect": {
      "type": "string"
    },
    "supersession_risk": {
      "type": "string"
    },
    "title": {
      "type": "string"
    },
    "url": {
      "type": "string"
    }
  },
  "required": [
    "repository",
    "pr_number",
    "title",
    "base_branch",
    "base_sha",
    "head_branch",
    "head_sha",
    "draft_state",
    "mergeability",
    "merge_state",
    "ci_result",
    "review_thread_state",
    "changed_paths",
    "governance_classification",
    "schema_effect",
    "implementation_effect",
    "lifecycle_effect",
    "overlap_with_other_prs",
    "dependency_state",
    "base_drift",
    "supersession_risk",
    "custody_requirement",
    "recommended_disposition",
    "exact_next_action",
    "responsible_owner",
    "deadline",
    "founder_decision_required",
    "merge_authority_state",
    "url"
  ],
  "title": "09_WORKSTREAM_PR_BRANCH_DISPOSITION/WORKSTREAM_PR_BRANCH_DISPOSITION_REGISTER.csv",
  "type": "object"
}
