[
  {
    "base_branch": "integrate-emergent-final-zip",
    "base_drift": "YES",
    "base_sha": "1eb384d80daa700ba2e71ee42872cc9bba926332",
    "changed_paths": "governance/portfolio/tier-1/drafting/EQUINESYNC_TIER_1_DOCUMENTS_03_10_V1/00_PROGRAM_CONTROL/DIRECTIVE_AUTHENTICATION_RECORD.json; governance/portfolio/tier-1/drafting/EQUINESYNC_TIER_1_DOCUMENTS_03_10_V1/00_PROGRAM_CONTROL/OPEN_PR_CONTEXT_REGISTER.csv; governance/portfolio/tier-1/drafting/EQUINESYNC_TIER_1_DOCUMENTS_03_10_V1/00_PROGRAM_CONTROL/REMOTE_BRANCH_CONTEXT_REGISTER.csv; governance/portfolio/tier-1/drafting/EQUINESYNC_TIER_1_DOCUMENTS_03_10_V1/00_PROGRAM_CONTROL/REPOSITORY_PRECHECK_REPORT.md; governance/portfolio/tier-1/drafting/EQUINESYNC_TIER_1_DOCUMENTS_03_10_V1/03_IMPLEMENTATION_TRACEABILITY/AUDIT_EVENT_AND_EVIDENCE_MATRIX.csv; governance/portfolio/tier-1/drafting/EQUINESYNC_TIER_1_DOCUMENTS_03_10_V1/03_IMPLEMENTATION_TRACEABILITY/CANONICAL_GUIDE_TO_REQUIREMENT_MATRIX.csv; governance/portfolio/tier-1/drafting/EQUINESYNC_TIER_1_DOCUMENTS_03_10_V1/03_IMPLEMENTATION_TRACEABILITY/CHECKSUMS.sha256; governance/portfolio/tier-1/drafting/EQUINESYNC_TIER_1_DOCUMENTS_03_10_V1/03_IMPLEMENTATION_TRACEABILITY/CONTROL_TO_FEATURE_SERVICE_AND_OWNER_MAP.csv; governance/portfolio/tier-1/drafting/EQUINESYNC_TIER_1_DOCUMENTS_03_10_V1/03_IMPLEMENTATION_TRACEABILITY/EQUINESYNC_MASTER_IMPLEMENTATION_MAPPING_REQUIREMENT_TEST_AND_EVIDENCE_TRACEABILITY_PACKAGE_V1_0.md; governance/portfolio/tier-1/drafting/EQUINESYNC_TIER_1_DOCUMENTS_03_10_V1/03_IMPLEMENTATION_TRACEABILITY/EQUINESYNC_MASTER_IMPLEMENTATION_MAPPING_REQUIREMENT_TEST_AND_EVIDENCE_TRACEABILITY_PACKAGE_V1_0_REVISION_AND_CRITICAL_REVIEW_REPORT.md; governance/portfolio/tier-1/drafting/EQUINESYNC_TIER_1_DOCUMENTS_03_10_V1/03_IMPLEMENTATION_TRACEABILITY/FAILURE_RETRY_ROLLBACK_AND_RECOVERY_MATRIX.csv; governance/portfolio/tier-1/drafting/EQUINESYNC_TIER_1_DOCUMENTS_03_10_V1/03_IMPLEMENTATION_TRACEABILITY/INVARIANT_TO_TEST_MATRIX.csv; governance/portfolio/tier-1/drafting/EQUINESYNC_TIER_1_DOCUMENTS_03_10_V1/03_IMPLEMENTATION_TRACEABILITY/OPEN_TRACEABILITY_GAP_REGISTER.csv; governance/portfolio/tier-1/drafting/EQUINESYNC_TIER_1_DOCUMENTS_03_10_V1/03_IMPLEMENTATION_TRACEABILITY/PACKAGE_MANIFEST.json; governance/portfolio/tier-1/drafting/EQUINESYNC_TIER_1_DOCUMENTS_03_10_V1/03_IMPLEMENTATION_TRACEABILITY/PERMISSION_ENFORCEMENT_MATRIX.csv; governance/portfolio/tier-1/drafting/EQUINESYNC_TIER_1_DOCUMENTS_03_10_V1/03_IMPLEMENTATION_TRACEABILITY/REQUIREMENT_CONFLICT_RESOLUTION_REGISTER.csv; governance/portfolio/tier-1/drafting/EQUINESYNC_TIER_1_DOCUMENTS_03_10_V1/03_IMPLEMENTATION_TRACEABILITY/REQUIREMENT_TO_IMPLEMENTATION_MAP.csv; governance/portfolio/tier-1/drafting/EQUINESYNC_TIER_1_DOCUMENTS_03_10_V1/03_IMPLEMENTATION_TRACEABILITY/SOURCE_REGISTER.csv; governance/portfolio/tier-1/drafting/EQUINESYNC_TIER_1_DOCUMENTS_03_10_V1/03_IMPLEMENTATION_TRACEABILITY/TRACEABILITY_MODEL.json; governance/portfolio/tier-1/drafting/EQUINESYNC_TIER_1_DOCUMENTS_03_10_V1/03_IMPLEMENTATION_TRACEABILITY/TRACEABILITY_VALIDATION_REPORT.md; governance/portfolio/tier-1/drafting/EQUINESYNC_TIER_1_DOCUMENTS_03_10_V1/03_IMPLEMENTATION_TRACEABILITY/tests/test_document_03.py; governance/portfolio/tier-1/drafting/EQUINESYNC_TIER_1_DOCUMENTS_03_10_V1/03_IMPLEMENTATION_TRACEABILITY/validators/validate_document_03.py; governance/portfolio/tier-1/drafting/EQUINESYNC_TIER_1_DOCUMENTS_03_10_V1/04_AUTHORITY_LIFECYCLE_REGISTER/AUTHORITY_LIFECYCLE_REGISTER.csv; governance/portfolio/tier-1/drafting/EQUINESYNC_TIER_1_DOCUMENTS_03_10_V1/04_AUTHORITY_LIFECYCLE_REGISTER/AUTHORITY_LIFECYCLE_REGISTER.json; governance/portfolio/tier-1/drafting/EQUINESYNC_TIER_1_DOCUMENTS_03_10_V1/04_AUTHORITY_LIFECYCLE_REGISTER/AUTHORITY_LIFECYCLE_REGISTER_GUIDE.md",
    "ci_result": "{\"SUCCESS\": 4, \"UNKNOWN\": 1}",
    "custody_requirement": "Founder merge directive and post-merge custody required before controlling use",
    "deadline": "FOUNDER_REVIEW_DATE_PLUS_14_DAYS",
    "dependency_state": "BLOCKED_PENDING_FOUNDER_DIRECTION",
    "draft_state": "DRAFT",
    "exact_next_action": "Keep draft and unmerged; reconcile against Round 2 package and obtain Founder direction before merge.",
    "founder_decision_required": "YES",
    "governance_classification": "TIER_1_DOCUMENTS_03_10_V1_HISTORICAL_CANDIDATE",
    "head_branch": "codex/tier-1-governance-documents-03-10-v1",
    "head_sha": "7748c4774037e89c32a12ccd8d52df2b0361e24f",
    "implementation_effect": "NO",
    "lifecycle_effect": "UNMERGED_DRAFT_CANDIDATE_CONTEXT_ONLY",
    "merge_authority_state": "MERGE_NOT_AUTHORIZED",
    "merge_state": "CLEAN",
    "mergeability": "MERGEABLE",
    "overlap_with_other_prs": "Requires reconciliation against PR #80 and PR #82 where governance/portfolio paths overlap",
    "pr_number": "82",
    "recommended_disposition": "retain as historical candidate; do not merge without Founder direction after Round 2 review",
    "repository": "rianray2012-coder/EquineSync-V4",
    "responsible_owner": "FOUNDER_OR_DELEGATED_GOVERNANCE_STEWARD",
    "review_thread_state": "",
    "schema_effect": "NO",
    "supersession_risk": "MEDIUM",
    "title": "Draft Tier 1 governance documents 03-10 V1 candidates",
    "url": "https://github.com/rianray2012-coder/EquineSync-V4/pull/82"
  },
  {
    "base_branch": "integrate-emergent-final-zip",
    "base_drift": "YES",
    "base_sha": "1eb384d80daa700ba2e71ee42872cc9bba926332",
    "changed_paths": "governance/portfolio/reviews/PR77_CURSOR_BACKSTOP_STRUCTURED_REVIEW_V1_0/ADOPTION_READINESS_DETERMINATION.md; governance/portfolio/reviews/PR77_CURSOR_BACKSTOP_STRUCTURED_REVIEW_V1_0/ADVERSARIAL_REVIEW_REGISTER.csv; governance/portfolio/reviews/PR77_CURSOR_BACKSTOP_STRUCTURED_REVIEW_V1_0/BASE_DRIFT_COMPATIBILITY_REPORT.md; governance/portfolio/reviews/PR77_CURSOR_BACKSTOP_STRUCTURED_REVIEW_V1_0/CHECKSUMS.sha256; governance/portfolio/reviews/PR77_CURSOR_BACKSTOP_STRUCTURED_REVIEW_V1_0/CLAUSE_BY_CLAUSE_REVIEW_MATRIX.csv; governance/portfolio/reviews/PR77_CURSOR_BACKSTOP_STRUCTURED_REVIEW_V1_0/HUMAN_MACHINE_CONSISTENCY_REPORT.md; governance/portfolio/reviews/PR77_CURSOR_BACKSTOP_STRUCTURED_REVIEW_V1_0/INDEPENDENT_REVIEW_FINDINGS_REGISTER.csv; governance/portfolio/reviews/PR77_CURSOR_BACKSTOP_STRUCTURED_REVIEW_V1_0/PACKAGE_MANIFEST.json; governance/portfolio/reviews/PR77_CURSOR_BACKSTOP_STRUCTURED_REVIEW_V1_0/README_FIRST.md; governance/portfolio/reviews/PR77_CURSOR_BACKSTOP_STRUCTURED_REVIEW_V1_0/REVIEWER_INDEPENDENCE_STATEMENT.md; governance/portfolio/reviews/PR77_CURSOR_BACKSTOP_STRUCTURED_REVIEW_V1_0/REVIEW_SUMMARY.md; governance/portfolio/reviews/PR77_CURSOR_BACKSTOP_STRUCTURED_REVIEW_V1_0/REVIEW_TARGET_AUTHENTICATION_REPORT.md; governance/portfolio/reviews/PR77_CURSOR_BACKSTOP_STRUCTURED_REVIEW_V1_0/SOURCE_AUTHENTICATION_REGISTER.csv",
    "ci_result": "{\"SUCCESS\": 4, \"UNKNOWN\": 1}",
    "custody_requirement": "Founder merge directive and post-merge custody required before controlling use",
    "deadline": "FOUNDER_REVIEW_DATE_PLUS_14_DAYS",
    "dependency_state": "BLOCKED_PENDING_EVIDENCE_OR_REBASE",
    "draft_state": "DRAFT",
    "exact_next_action": "Keep draft and unmerged; reconcile against Round 2 package and obtain Founder direction before merge.",
    "founder_decision_required": "YES",
    "governance_classification": "GOVERNANCE_DOCUMENTARY_CANDIDATE",
    "head_branch": "cursor/pr77-backstop-structured-review-7ec6",
    "head_sha": "94f62f9174e7e4e86a0b5b51e79bfb4aada9b25c",
    "implementation_effect": "NO",
    "lifecycle_effect": "UNMERGED_DRAFT_CANDIDATE_CONTEXT_ONLY",
    "merge_authority_state": "MERGE_NOT_AUTHORIZED",
    "merge_state": "CLEAN",
    "mergeability": "MERGEABLE",
    "overlap_with_other_prs": "No direct overlap concluded; path-level review still required",
    "pr_number": "81",
    "recommended_disposition": "continue review",
    "repository": "rianray2012-coder/EquineSync-V4",
    "responsible_owner": "FOUNDER_OR_DELEGATED_GOVERNANCE_STEWARD",
    "review_thread_state": "",
    "schema_effect": "NO",
    "supersession_risk": "MEDIUM",
    "title": "PR #77 Cursor backstop structured review findings",
    "url": "https://github.com/rianray2012-coder/EquineSync-V4/pull/81"
  },
  {
    "base_branch": "integrate-emergent-final-zip",
    "base_drift": "YES",
    "base_sha": "1eb384d80daa700ba2e71ee42872cc9bba926332",